{
  "$schema": "../../schemas/resource.schema.json",
  "schema": 1,
  "name": "synex_bridge_qb",
  "version": "0.1.0",
  "synex": "^1.0.0",
  "critical": false,
  "capabilities": {
    "request": [
      "synex.capabilities.delegate",
      "synex.identity.read",
      "synex.accounts.read",
      "synex.accounts.transfer",
      "synex.groups.read"
    ]
  },
  "services": {
    "provide": [],
    "require": ["synex.accounts@1", "synex.groups@1"],
    "optional": []
  },
  "contracts": {
    "provide": [],
    "consume": ["synex.accounts.transfer"]
  },
  "dependencies": {
    "required": [
      {
        "name": "synex_core",
        "version": ">=0.1.0"
      },
      {
        "name": "synex_bridge",
        "version": ">=0.1.0"
      },
      {
        "name": "synex_accounts",
        "version": ">=0.1.0"
      },
      {
        "name": "synex_groups",
        "version": ">=0.1.0"
      }
    ],
    "optional": [],
    "development": []
  },
  "migrations": [],
  "dataOwnership": {
    "tables": [],
    "characterDelete": "none"
  },
  "stateSnapshot": {
    "supported": false,
    "schemaVersion": 1
  }
}
